{
  "schema_version": "1",
  "contract_ref": {
    "member": "ООО «Пример-Строй» (вымышленная компания)",
    "role": "contractor",
    "number": "ГП-14/2026",
    "date": "2026-04-03",
    "customer": "ООО «СЗ Пример-Девелопмент»",
    "customer_kind": "developer",
    "kind": "construction",
    "work_type": "construction",
    "price_rub": 148000000.0,
    "price_band": "90–500 млн ₽",
    "procurement": "direct",
    "status": "active",
    "object": "Многоквартирный жилой дом со встроенными помещениями, 14 этажей",
    "object_category": "ordinary",
    "as_of": "2026-09-01"
  },
  "verdict": {
    "membership_required": "yes",
    "sro_kind": "build",
    "counts_for_odo": "no",
    "odo_note": "direct_excluded",
    "amount_total_rub": 148000000.0,
    "amount_sro_rub": 71000000.0,
    "amount_non_sro_rub": 77000000.0,
    "amount_unresolved_rub": null,
    "remaining_rub": 108600000.0,
    "remaining_sro_rub": 52098648.65,
    "share_sro": 0.4797,
    "share_basis": "по стоимости видов работ",
    "confidence": 0.9,
    "summary": "Договор № ГП-14/2026 (148 000 000,00 ₽) требует членства в СРО строителей. В совокупный размер обязательств по КФ ОДО он не входит: заключён без конкурентных процедур (ч. 3 ст. 55.8 ГрК РФ); уведомлению в СРО подлежит (ч. 4 ст. 55.8). Остаток обязательств 108 600 000,00 ₽; справочно по Перечню 624 из них работы, влияющие на безопасность, — 52 098 648,65 ₽ (48 %)."
  },
  "findings": [
    {
      "step": 1,
      "title": "Вид договора",
      "conclusion": "info",
      "explanation": "По содержанию обязательств это строительный подряд. Основание: п. 1.1: выполнить комплекс работ по строительству и сдать результат; п. 6 — приёмка по актам КС-2/КС-3. Пункт 2 ст. 740 ГК РФ распространяет строительный подряд и на монтажные, пусконаладочные и иные неразрывно связанные работы, а также на капитальный ремонт.",
      "basis": [
        "gk-740",
        "gk-702"
      ],
      "missing": []
    },
    {
      "step": 2,
      "title": "Объект и характер работ",
      "conclusion": "info",
      "explanation": "Объект — объект капитального строительства. Характер работ — строительство. Объект обычный (не ст. 48.1 ГрК РФ): работы Перечня со знаком «*» к влияющим на безопасность не относятся. Основание: проектная документация: жилой дом высотой 44 м, к объектам ст. 48.1 ГрК РФ не относится.",
      "basis": [
        "grk-1-10",
        "grk-1-13",
        "grk-48.1",
        "order-624-note",
        "letter-33838"
      ],
      "missing": []
    },
    {
      "step": 3,
      "title": "Стороны договора",
      "conclusion": "yes",
      "explanation": "Заказчик — ООО «СЗ Пример-Девелопмент»: застройщик. Основание: разрешение на строительство № 00-000-2026 от 12.02.2026 выдано заказчику; проектная декларация на наш.дом.рф. По стороне заказчика препятствий нет: договор подряда с таким заказчиком требует членства подрядчика в СРО и учитывается в совокупном размере — при соблюдении остальных условий (порог, способ заключения, статус).",
      "basis": [
        "grk-1-16",
        "grk-52-2.1",
        "grk-48-4",
        "grk-47-2"
      ],
      "missing": []
    },
    {
      "step": 4,
      "title": "Порог по одному договору",
      "conclusion": "yes",
      "explanation": "Размер обязательств по договору 148 000 000,00 ₽ выше порога 10 000 000 ₽: обязательное членство в СРО строителей.",
      "basis": [
        "grk-52-2.1",
        "fz-124"
      ],
      "missing": []
    },
    {
      "step": 5,
      "title": "Совокупный размер обязательств",
      "conclusion": "no",
      "explanation": "Договор заключён без конкурентных процедур. Совокупный размер обязательств по КФ ОДО считается по договорам, заключённым с использованием конкурентных способов (ч. 3 ст. 55.8, ч. 7 ст. 55.13 ГрК РФ в редакции 2026 года): прямой договор в него не входит. При этом с 1 марта 2026 года о заключении, изменении, исполнении и расторжении такого договора член СРО уведомляет СРО в три рабочих дня (ч. 4 ст. 55.8). Основание: договор заключён по результатам переговоров, торги не проводились (письмо заказчика).",
      "basis": [
        "grk-55.8-3",
        "grk-55.13-7",
        "grk-55.8-4",
        "fz-309"
      ],
      "missing": []
    },
    {
      "step": 6,
      "title": "Исполненная часть",
      "conclusion": "info",
      "explanation": "Принято по актам 39 400 000,00 ₽; остаток обязательств 108 600 000,00 ₽ — именно он входит в совокупный размер. Основание: КС-3 № 1–3 за апрель–июнь 2026.",
      "basis": [
        "grk-55.13-7",
        "gk-753"
      ],
      "missing": []
    },
    {
      "step": 6,
      "title": "Виды работ по Перечню 624",
      "conclusion": "info",
      "explanation": "Видов работ: 10; по Перечню 624 относятся к влияющим на безопасность («СРО»): 3, не относятся: 7, не решено: 0. Разделение по Перечню показывает состав цены и не меняет учёт договора: с 01.07.2017 обязанность членства и совокупный размер обязательств определяются договором (вид, заказчик, цена, способ заключения), а не видом работ.",
      "basis": [
        "order-624",
        "fz-372",
        "grk-52-2.1"
      ],
      "missing": []
    }
  ],
  "works": [
    {
      "name": "Устройство монолитного железобетонного каркаса (фундаментная плита, стены, перекрытия)",
      "amount_rub": 62000000.0,
      "sro": true,
      "perechen_code": "III/6.3",
      "perechen_title": "Устройство монолитных бетонных и железобетонных конструкций",
      "asterisk": false,
      "kind": "perechen",
      "reason": "Перечень 624, п. 6.3 раздела III: Устройство монолитных бетонных и железобетонных конструкций",
      "confidence": 0.85,
      "note": null,
      "basis": [
        "order-624"
      ],
      "source": "приложение № 1, разд. 1"
    },
    {
      "name": "Кладка наружных и внутренних стен из газобетонных блоков",
      "amount_rub": 14000000.0,
      "sro": false,
      "perechen_code": "III/9.2",
      "perechen_title": "Устройство конструкций из кирпича, в том числе с облицовкой",
      "asterisk": true,
      "kind": "perechen",
      "reason": "Перечень 624, п. 9.2 раздела III: Устройство конструкций из кирпича, в том числе с облицовкой — со звёздочкой: на обычном объекте (не ст. 48.1) допуска не требовало, в расчёт не идёт",
      "confidence": 0.85,
      "note": "Несколько правил равного приоритета: B-STONE → III/9.1",
      "basis": [
        "grk-48.1",
        "letter-33838",
        "order-624",
        "order-624-note"
      ],
      "source": "приложение № 1, разд. 2"
    },
    {
      "name": "Устройство кровли из рулонных материалов",
      "amount_rub": 6000000.0,
      "sro": false,
      "perechen_code": "III/13.2",
      "perechen_title": "Устройство кровель из рулонных материалов",
      "asterisk": true,
      "kind": "perechen",
      "reason": "Перечень 624, п. 13.2 раздела III: Устройство кровель из рулонных материалов — со звёздочкой: на обычном объекте (не ст. 48.1) допуска не требовало, в расчёт не идёт",
      "confidence": 0.85,
      "note": null,
      "basis": [
        "grk-48.1",
        "letter-33838",
        "order-624",
        "order-624-note"
      ],
      "source": "приложение № 1, разд. 3"
    },
    {
      "name": "Устройство внутренних систем водоснабжения, канализации и отопления",
      "amount_rub": 12000000.0,
      "sro": false,
      "perechen_code": "III/15.1",
      "perechen_title": "Устройство и демонтаж системы водопровода и канализации",
      "asterisk": true,
      "kind": "perechen",
      "reason": "Перечень 624, п. 15.1 раздела III: Устройство и демонтаж системы водопровода и канализации — со звёздочкой: на обычном объекте (не ст. 48.1) допуска не требовало, в расчёт не идёт",
      "confidence": 0.85,
      "note": "Несколько правил равного приоритета: B-INT-HEATING → III/15.2",
      "basis": [
        "grk-48.1",
        "letter-33838",
        "order-624",
        "order-624-note"
      ],
      "source": "приложение № 1, разд. 4"
    },
    {
      "name": "Устройство внутренних сетей электроснабжения",
      "amount_rub": 9000000.0,
      "sro": false,
      "perechen_code": "III/15.5",
      "perechen_title": "Устройство системы электроснабжения",
      "asterisk": true,
      "kind": "perechen",
      "reason": "Перечень 624, п. 15.5 раздела III: Устройство системы электроснабжения — со звёздочкой: на обычном объекте (не ст. 48.1) допуска не требовало, в расчёт не идёт",
      "confidence": 0.85,
      "note": null,
      "basis": [
        "grk-48.1",
        "letter-33838",
        "order-624",
        "order-624-note"
      ],
      "source": "приложение № 1, разд. 5"
    },
    {
      "name": "Отделочные работы: штукатурка, шпатлёвка, окраска, плитка, полы",
      "amount_rub": 22000000.0,
      "sro": false,
      "perechen_code": null,
      "perechen_title": null,
      "asterisk": null,
      "kind": "not_in_list",
      "reason": "Штукатурные работы: в Перечне 624 отсутствуют (кроме фасадных по группе 14)",
      "confidence": 0.85,
      "note": null,
      "basis": [
        "fz-372",
        "order-624"
      ],
      "source": "приложение № 1, разд. 6"
    },
    {
      "name": "Поставка лифтового оборудования",
      "amount_rub": 11000000.0,
      "sro": false,
      "perechen_code": null,
      "perechen_title": null,
      "asterisk": null,
      "kind": "non_work",
      "reason": "Поставка/покупка: не подрядные работы",
      "confidence": 0.85,
      "note": null,
      "basis": [
        "gk-506",
        "order-624"
      ],
      "source": "приложение № 1, разд. 7"
    },
    {
      "name": "Монтаж лифтов и пусконаладочные работы лифтов",
      "amount_rub": 4000000.0,
      "sro": true,
      "perechen_code": "III/24.2",
      "perechen_title": "Пусконаладочные работы лифтов",
      "asterisk": false,
      "kind": "perechen",
      "reason": "Перечень 624, п. 24.2 раздела III: Пусконаладочные работы лифтов",
      "confidence": 0.85,
      "note": null,
      "basis": [